<?xml version="1.0" encoding="UTF-8" ?>
<!ELEMENT books (book*)>
<!ELEMENT book (author,name,price)>
<!ATTLIST book id CDATA #REQUIRED>
<!ELEMENT author (#PCDATA)>
<!ELEMENT name (#PCDATA)>
<!ELEMENT price (#PCDATA)>