<?xml version="1.0" encoding="UTF-8" ?>
<!DOCTYPE books SYSTEM "src\book.dtd">
<books>
    <book id="1">
        <author>gjy</author>
        <name>爱你的日子里</name>
        <price>30￥</price>
    </book>
    <book id="2">
        <author>gjy</author>
        <name>爱你的日子里</name>
        <price>30￥</price>
    </book>
</books>